name,ritual_type,description,date,recurrence_pattern,lunar_date_tithi,performed_by,location_name,route_description,start_place,end_place
Kumari Puja,Puja,"Worship ceremony of the Royal Kumari during Indra Jatra. The Kumari is carried in a golden palanquin through the old city, blessing crowds and receiving offerings.",Bhadra/Ashwin (Sep),Annual,Ashwin Shukla Chaturdashi,Kumari priests (Vajracharya),Kathmandu Durbar Square,"Procession from Kumari Ghar through Indra Chowk, Ason, and back",Kumari Ghar,Hanuman Dhoka
Samyak,Puja,"Grand Buddhist festival where hundreds of Buddha statues from private homes and monasteries are displayed in public squares for collective worship. Occurs once every 5 or 12 years.",Varies,Every 5 years (Patan) / 12 years (Kathmandu),,Buddhist communities (Shakya and Vajracharya),Patan and Kathmandu,Statues brought from monasteries and homes to central squares,Various Viharas,Patan Durbar Square
Matya,Jatra,"Buddhist pilgrimage circuit around the old city of Patan. Devotees visit every Buddhist shrine and monastery in a single day. Includes lighting butter lamps at each site.",Shrawan (Jul-Aug),Annual,Shrawan Purnima,Newar Buddhist lay communities,Patan (Lalitpur),"Complete circuit of all Buddhist sites in Patan — covers 150+ shrines in one day",Oku Bahal,Oku Bahal (circular)
Navami Puja at Taleju,Puja,"Secret tantric worship of Taleju Bhawani performed during Dashain. The only day the inner sanctum of Taleju Temple is open to the public. Animal sacrifices offered.",Ashwin (Sep-Oct),Annual,Mahanavami (Dashain 9th day),Karmacharya priests,Taleju Temple Kathmandu,,Taleju Temple,Taleju Temple
Shraddha Ceremony,Shraddha,"Ancestral rite performed at Pashupatinath and other riverside locations. Offerings of food, water, and pindas (rice balls) to deceased family members.",Throughout year,Annual per family,Varies per death anniversary,Hindu Brahmin priests,Pashupatinath Temple,"Performed at specific ghats along the Bagmati River",Arya Ghat,Arya Ghat
Homa at Swayambhu,Homa,"Fire ritual performed by Vajracharya priests at the base of Swayambhunath Stupa. Offerings of ghee, grain, and herbs are made to purify the environment and invoke blessings.",Full moon days,Monthly,Purnima,Vajracharya priests,Swayambhunath,Performed at the main fire altar on the eastern side of the stupa,Eastern fire altar,Eastern fire altar
Ihi (Bel Bibaha),Diksha,"Pre-puberty initiation ceremony for Newar girls. The girl is 'married' to the bel fruit (wood apple), symbolizing Vishnu. Ensures she is never truly widowed.",Varies,As needed per girl child,Auspicious day per astrology,Senior women and Brahmin priests,Family home / community hall,"Procession from home to ceremony hall with the girl dressed as a bride",Girl's home,Community Guthi hall
